{
  "$schema": "http://json-schema.org/draft-07/schema#",
  "$id": "md-graph.schema.json",
  "title": "graph.json (salida de la skill md-graph)",
  "description": "Grafo de dependencias del codigo de un proyecto, generado por la skill md-graph a partir de su exploracion directa del codigo fuente (sin parser externo ni motor de graphify). Pensado como contexto reducido de arquitectura -- lo consume por ejemplo ms-implement via framework.projectGraphPath en .claude/ms-context.json. Se reescribe completo en cada invocacion de md-graph, no es incremental.",
  "type": "object",
  "required": ["generatedAt", "basePath", "nodes", "edges"],
  "additionalProperties": false,
  "properties": {
    "generatedAt": {
      "type": "string",
      "description": "Fecha/hora ISO 8601 en que se genero este grafo.",
      "examples": ["2026-07-17T00:00:00Z"]
    },
    "basePath": {
      "type": "string",
      "description": "Ruta base (relativa a la raiz del repo) del codigo que se recorrio para construir el grafo -- la resuelta en el paso 0 de md-graph (argumento, o framework.sourcecodeDir de ms-context.json).",
      "examples": ["src"]
    },
    "nodes": {
      "type": "array",
      "description": "Un nodo por fichero de codigo recorrido, mas un nodo por cada simbolo (funcion/clase) que ese fichero exporta. Los simbolos privados/no exportados no generan nodo -- el grafo solo recoge lo que otras partes del codigo pueden consumir.",
      "items": {
        "type": "object",
        "required": ["id", "type", "path", "purpose"],
        "additionalProperties": false,
        "properties": {
          "id": {
            "type": "string",
            "description": "Identificador unico del nodo. Para un nodo 'file', es su path relativo a basePath. Para un nodo 'function'/'class', es '{path del fichero}#{nombre del simbolo}'.",
            "examples": ["core/state.js", "core/state.js#getState"]
          },
          "type": {
            "type": "string",
            "enum": ["file", "function", "class"],
            "description": "Tipo de nodo."
          },
          "path": {
            "type": "string",
            "description": "Ruta del fichero (relativa a basePath) al que pertenece el nodo -- para nodos 'file', el propio fichero; para 'function'/'class', el fichero que lo define.",
            "examples": ["core/state.js"]
          },
          "purpose": {
            "type": "string",
            "description": "Descripcion breve (una frase) de la responsabilidad del fichero, o del proposito de la funcion/clase, escrita por md-graph al leer el codigo."
          },
          "exports": {
            "type": "array",
            "description": "Solo en nodos 'file': nombres de los simbolos exportados por ese fichero (cada uno con su propio nodo 'function'/'class' en este mismo grafo).",
            "items": { "type": "string" }
          },
          "parent": {
            "type": "string",
            "description": "Solo en nodos 'function'/'class': id del nodo 'file' que lo define.",
            "examples": ["core/state.js"]
          }
        }
      }
    },
    "edges": {
      "type": "array",
      "description": "Relaciones entre nodos. Vocabulario minimo deliberado (sin comunidades, sin confidence scores, sin hyperedges) -- el objetivo es contexto reducido, no un grafo de conocimiento exhaustivo.",
      "items": {
        "type": "object",
        "required": ["source", "target", "relation"],
        "additionalProperties": false,
        "properties": {
          "source": { "type": "string", "description": "id del nodo origen." },
          "target": { "type": "string", "description": "id del nodo destino." },
          "relation": {
            "type": "string",
            "enum": ["imports", "calls", "extends"],
            "description": "'imports': fichero a fichero, de una sentencia import. 'calls': funcion/metodo a funcion/metodo exportado que invoca (solo si se resuelve a un nodo del propio grafo). 'extends': clase a clase, herencia."
          }
        }
      }
    }
  },
  "examples": [
    {
      "generatedAt": "2026-07-17T00:00:00Z",
      "basePath": "src",
      "nodes": [
        {
          "id": "core/state.js",
          "type": "file",
          "path": "core/state.js",
          "purpose": "Fuente unica de verdad del estado de la app; expone getState/setState y emite eventos de cambio",
          "exports": ["getState", "setState"]
        },
        {
          "id": "core/state.js#getState",
          "type": "function",
          "path": "core/state.js",
          "parent": "core/state.js",
          "purpose": "Devuelve una copia del estado actual"
        }
      ],
      "edges": [
        { "source": "modes/edit/editMode.js", "target": "core/state.js", "relation": "imports" },
        { "source": "modes/edit/editMode.js#renderEdit", "target": "core/state.js#getState", "relation": "calls" }
      ]
    }
  ]
}
