{
  "generatedAt": "2026-08-01T10:06:16Z",
  "basePath": "src",
  "nodes": [
    {
      "id": "core/cardProportions.js",
      "type": "file",
      "path": "core/cardProportions.js",
      "exports": [
        "CARD_DESIGN_WIDTH",
        "CARD_PROPORTIONS",
        "getCartaShapeCss",
        "getDesignSize",
        "getHexInnerClipPath",
        "getProporcionRatio"
      ],
      "purpose": "Catálogo puro de proporciones de carta (ratio y forma) y helpers para derivar el border-radius/clip-path y el tamaño de diseño de cada proporción, sin depender de otras capas."
    },
    {
      "id": "core/component.js",
      "type": "file",
      "path": "core/component.js",
      "exports": [
        "cloneComponent",
        "createComponent",
        "createCopy",
        "nextCloneId",
        "nextCopyId",
        "renameCopyId",
        "syncCopyWithOriginal",
        "updateComponent"
      ],
      "purpose": "Modelo genérico de componente de juego: construcción/actualización, clonado, y el mecanismo de Copia vinculada (creación, renombrado e id, y sincronización de campos con el original)."
    },
    {
      "id": "core/deck.js",
      "type": "file",
      "path": "core/deck.js",
      "exports": [
        "MAZO_REVEAL_GAP",
        "computeSacarCartaDeMazo",
        "getCartaIdsEnAlgunMazo",
        "getMazoRevealZoneRect",
        "rectsOverlap",
        "shuffleCartaIds"
      ],
      "purpose": "Lógica pura del componente \"Mazo\": barajar, calcular la zona de revelado y los ids de carta ya dentro de algún mazo, y computar el resultado de sacar una carta de la pila."
    },
    {
      "id": "core/dice.js",
      "type": "file",
      "path": "core/dice.js",
      "exports": [
        "esResultadoValido",
        "getPosibleValores",
        "getResultadoInicial",
        "isListaValoresValida",
        "parseListaValores",
        "tirarDado"
      ],
      "purpose": "Lógica pura de sorteo y validación de resultados del componente 'Dado' (valores posibles, resultado inicial, validez y tirada), sin dependencias de otras capas."
    },
    {
      "id": "core/eventBus.js",
      "type": "file",
      "path": "core/eventBus.js",
      "exports": [
        "emit",
        "off",
        "on"
      ],
      "purpose": "Bus de eventos simple pub/sub (on/off/emit) usado para desacoplar las capas de la app."
    },
    {
      "id": "core/fichaMigration.js",
      "type": "file",
      "path": "core/fichaMigration.js",
      "exports": [
        "migrateFichaComponent",
        "migrateFichaProperties"
      ],
      "purpose": "Migra las properties del extinto tipo de componente 'ficha' al modelo de 'carta', de forma best-effort y sin lanzar excepciones, devolviendo también la lista de errores encontrados."
    },
    {
      "id": "core/fileExport.js",
      "type": "file",
      "path": "core/fileExport.js",
      "exports": [
        "buildExportHtml",
        "downloadHtml",
        "downloadJson"
      ],
      "purpose": "Genera una copia autocontenida del HTML actual con el estado embebido y dispara la descarga de ficheros HTML/JSON."
    },
    {
      "id": "core/group.js",
      "type": "file",
      "path": "core/group.js",
      "exports": [
        "createGroup",
        "getComponentsUsingGroup",
        "isGroupNameTaken",
        "updateGroup"
      ],
      "purpose": "Modelo minimo de grupo (agrupacion de elementos de cualquier tipo): crear/actualizar, validar nombre unico y listar componentes que pertenecen a un grupo."
    },
    {
      "id": "core/imageConversion.js",
      "type": "file",
      "path": "core/imageConversion.js",
      "exports": [
        "convertImageToWebP"
      ],
      "purpose": "Convierte imágenes subidas a la galería (png/jpg/jpeg) a formato WebP para reducir su tamaño, cayendo al original si la conversión falla o no aplica."
    },
    {
      "id": "core/importMerge.js",
      "type": "file",
      "path": "core/importMerge.js",
      "exports": [
        "mergeImportedGame",
        "nextImportedId"
      ],
      "purpose": "Fusiona la selección de componentes/recursos/mazos de una importación con el estado actual del juego según el modo elegido, resolviendo conflictos de id y referencias rotas."
    },
    {
      "id": "core/markdown.js",
      "type": "file",
      "path": "core/markdown.js",
      "exports": [
        "markdownToHtml"
      ],
      "purpose": "Envoltorio mínimo sobre la librería vendorizada marked.js para convertir Markdown a HTML en el componente 'Visor de documentos'."
    },
    {
      "id": "core/persistence.js",
      "type": "file",
      "path": "core/persistence.js",
      "exports": [
        "buildComponentsExport",
        "loadState",
        "parseImportedComponents",
        "readSeedState",
        "saveState"
      ],
      "purpose": "Persistencia del estado de la app: autoguardado/lectura en localStorage, lectura de la semilla embebida en el documento, y parseo/construcción de los datos de importación/exportación de componentes."
    },
    {
      "id": "core/resource.js",
      "type": "file",
      "path": "core/resource.js",
      "exports": [
        "RESOURCE_TYPES",
        "createResource",
        "getComponentsUsingResource",
        "isResourceInUse",
        "resourceTypeForFileName",
        "updateResource"
      ],
      "purpose": "Modelo genérico de recurso de la galería (imagen o tipografía): creación/edición y localización de qué componentes referencian un recurso dado."
    },
    {
      "id": "core/sanitizeHtml.js",
      "type": "file",
      "path": "core/sanitizeHtml.js",
      "exports": [
        "sanitizeHtml"
      ],
      "purpose": "Sanitiza HTML de usuario antes de insertarlo en el DOM, eliminando <script>, atributos on* y protocolos javascript: en href/src."
    },
    {
      "id": "core/state.js",
      "type": "file",
      "path": "core/state.js",
      "exports": [
        "MODES",
        "addComponent",
        "addGroup",
        "addResource",
        "getComponents",
        "getGroupPanelState",
        "getGroups",
        "getPanelState",
        "getResourcePanelState",
        "getResources",
        "getResourcesSeeded",
        "getState",
        "loadComponents",
        "loadGroupPanelState",
        "loadGroups",
        "loadPanelState",
        "loadResourcePanelState",
        "loadResources",
        "loadResourcesSeeded",
        "markResourcesSeeded",
        "removeComponent",
        "removeGroup",
        "removeResource",
        "reorderComponent",
        "replaceComponent",
        "replaceGroup",
        "replaceResource",
        "sacarCartaDeMazo",
        "setGroupPanelState",
        "setMode",
        "setPanelState",
        "setResourcePanelState"
      ],
      "purpose": "Estado central de la aplicación (modo activo, componentes, recursos, mazos y estado de los paneles flotantes): todas las mutaciones y su notificación vía eventBus."
    },
    {
      "id": "core/styleClipboard.js",
      "type": "file",
      "path": "core/styleClipboard.js",
      "exports": [
        "getStyleClipboard",
        "hasStyleClipboard",
        "setStyleClipboard",
        "validateStyleClipboardForPaste"
      ],
      "purpose": "Portapapeles en memoria de 'Copiar/Pegar estilo' entre cartas: guarda/lee el estilo copiado y valida que sus referencias (mazo, recursos) sigan existiendo antes de pegarlo."
    },
    {
      "id": "core/textBoxLayout.js",
      "type": "file",
      "path": "core/textBoxLayout.js",
      "exports": [
        "getTextBoxLayoutStyle"
      ],
      "purpose": "Traduce la alineación y los márgenes de un cuadro de texto de carta a los estilos CSS flex usados al renderizarlo."
    },
    {
      "id": "data/defaultResources.js",
      "type": "file",
      "path": "data/defaultResources.js",
      "exports": [
        "DEFAULT_RESOURCES"
      ],
      "purpose": "Datos puros con los recursos (imágenes/tipografías) por defecto que se siembran en una sesión completamente nueva de la app."
    },
    {
      "id": "data/version.js",
      "type": "file",
      "path": "data/version.js",
      "exports": [
        "CURRENT_VERSION"
      ],
      "purpose": "Fuente única de la versión actual del prototipo, usada por persistencia/exportación para invalidar guardados de otras versiones."
    },
    {
      "id": "main.js",
      "type": "file",
      "path": "main.js",
      "purpose": "Bootstrap de la aplicación: conecta las capas, monta el modo activo y sus refrescos ante eventos, y siembra el estado inicial (componentes/recursos por defecto o recuperados de guardado/semilla)."
    },
    {
      "id": "modes/edit/editMode.js",
      "type": "file",
      "path": "modes/edit/editMode.js",
      "exports": [
        "deleteSelectedComponent",
        "renderEditMode"
      ],
      "purpose": "Modo edición: monta la mesa infinita con los componentes seleccionables y los tres paneles flotantes (Componentes/Recursos/Mazos) con sus acciones de alta/edición/borrado, y trae automáticamente al frente el panel con el que se interactúa (cambio 00101)."
    },
    {
      "id": "modes/play/playMode.js",
      "type": "file",
      "path": "modes/play/playMode.js",
      "exports": [
        "renderPlayMode"
      ],
      "purpose": "Modo juego: monta la mesa infinita con los componentes interactuables (arrastre, lanzar dado, voltear carta, menú contextual de bloqueo)."
    },
    {
      "id": "scripts/obfuscate_bundle.js",
      "type": "file",
      "path": "scripts/obfuscate_bundle.js",
      "purpose": "Script Node CLI que ofusca un fichero JS usando el bundle vendorizado de javascript-obfuscator, sin depender de npm/npx."
    },
    {
      "id": "scripts/vendor/javascript-obfuscator.browser.js",
      "type": "file",
      "path": "scripts/vendor/javascript-obfuscator.browser.js",